{
  "schema_version": "symmetry.admission.v1",
  "admission_id": "56565656-5656-4656-8656-565656565656",
  "goal_id": "11111111-1111-4111-8111-111111111111",
  "goal_revision": 1,
  "work_item_id": "33333333-3333-4333-8333-333333333333",
  "purpose": "implement",
  "context_snapshot_id": "44444444-4444-4444-8444-444444444444",
  "context_hash": "sha256:1111111111111111111111111111111111111111111111111111111111111111",
  "model_profile": "implementation-default",
  "session_mode": "fresh",
  "requested_session_id": null,
  "subject": {
    "resource_id": "22222222-2222-4222-8222-222222222222",
    "commit": "0123456789abcdef0123456789abcdef01234567",
    "tree_digest": "sha256:0000000000000000000000000000000000000000000000000000000000000000"
  },
  "limits": {
    "max_turns": 1,
    "deadline_at": "2026-09-09T00:00:00Z",
    "max_cost_microusd": "250000"
  },
  "validation_of_task_id": null,
  "provider_scope": {
    "resource_ids": [
      "22222222-2222-4222-8222-222222222222"
    ],
    "operations_by_resource": {
      "22222222-2222-4222-8222-222222222222": [
        "change.upsert"
      ]
    },
    "change_target": {
      "kind": "branches",
      "source_branch": "codex/goal-0006",
      "target_branch": "main"
    }
  }
}
