{
  "schema_version": "symmetry.admission.v1",
  "admission_id": "56565656-5656-4565-8565-565656565656",
  "goal_id": "11111111-1111-4111-8111-111111111111",
  "goal_revision": 1,
  "work_item_id": null,
  "purpose": "plan",
  "context_snapshot_id": "45454545-4545-4454-8454-454545454545",
  "context_hash": "sha256:1111111111111111111111111111111111111111111111111111111111111111",
  "model_profile": "planning-default",
  "session_mode": "fresh",
  "requested_session_id": null,
  "subject": {
    "resource_id": "22222222-2222-4222-8222-222222222222",
    "commit": "0123456789abcdef0123456789abcdef01234567",
    "tree_digest": "sha256:0000000000000000000000000000000000000000000000000000000000000000"
  },
  "limits": {
    "max_turns": 1,
    "deadline_at": "2026-09-10T00:00:00Z",
    "max_cost_microusd": null
  },
  "validation_of_task_id": null,
  "provider_scope": null
}
