{
  "schema_version": "symmetry.admission.v1",
  "admission_id": "57575757-5757-4575-8575-575757575757",
  "goal_id": "11111111-1111-4111-8111-111111111111",
  "goal_revision": 1,
  "work_item_id": "33333333-3333-4333-8333-333333333333",
  "purpose": "validate",
  "context_snapshot_id": "44444444-4444-4444-8444-444444444444",
  "context_hash": "sha256:1111111111111111111111111111111111111111111111111111111111111111",
  "model_profile": "validation-default",
  "session_mode": "fresh",
  "requested_session_id": null,
  "subject": {
    "resource_id": "22222222-2222-4222-8222-222222222222",
    "commit": "0123456789abcdef0123456789abcdef01234567",
    "tree_digest": "sha256:0000000000000000000000000000000000000000000000000000000000000000"
  },
  "limits": {
    "max_turns": 1,
    "deadline_at": "2026-09-09T00:00:00Z",
    "max_cost_microusd": "250000"
  },
  "validation_of_task_id": "77777777-7777-4777-8777-777777777777",
  "provider_scope": null
}
